{
  "version": 1,
  "lastUpdated": "2026-05-03T14:43:00Z",
  "approvedCategories": [
    "courage",
    "encouragement",
    "healing",
    "hope",
    "identity",
    "peace",
    "perseverance",
    "purpose",
    "wisdom"
  ],
  "quotes": [
    {
      "id": "abdul-kalam-dream",
      "quote": "You have to dream before your dreams can come true.",
      "author": "A. P. J. Abdul Kalam",
      "source": "Wings of Fire, p. 112",
      "sourceUrl": "https://en.wikiquote.org/wiki/A._P._J._Abdul_Kalam",
      "categories": ["hope", "purpose"],
      "approved": true,
      "active": true
    },
    {
      "id": "viktor-frankl-change",
      "quote": "When we are no longer able to change a situation, we are challenged to change ourselves.",
      "author": "Viktor E. Frankl",
      "source": "Man's Search for Meaning",
      "sourceUrl": "https://en.wikiquote.org/wiki/Viktor_Frankl",
      "categories": ["courage", "identity"],
      "approved": true,
      "active": true
    },
    {
      "id": "marcus-aurelius-mind",
      "quote": "You have power over your mind - not outside events. Realize this, and you will find strength.",
      "author": "Marcus Aurelius",
      "source": "Meditations, Book 12.36",
      "sourceUrl": "https://en.wikiquote.org/wiki/Marcus_Aurelius",
      "categories": ["courage", "wisdom"],
      "approved": true,
      "active": true
    },
    {
      "id": "helen-keller-optimism",
      "quote": "Optimism is the faith that leads to achievement. Nothing can be done without hope and confidence.",
      "author": "Helen Keller",
      "source": "Optimism: An Essay",
      "sourceUrl": "https://en.wikiquote.org/wiki/Helen_Keller",
      "categories": ["hope", "encouragement"],
      "approved": true,
      "active": true
    },
    {
      "id": "mother-teresa-small-things",
      "quote": "We can do no great things, only small things with great love.",
      "author": "Mother Teresa",
      "source": "Nobel Peace Prize acceptance speech (1979)",
      "sourceUrl": "https://www.nobelprize.org/prizes/peace/1979/teresa/acceptance-speech/",
      "categories": ["purpose", "encouragement"],
      "approved": true,
      "active": true
    },
    {
      "id": "mlk-darkness",
      "quote": "Darkness cannot drive out darkness; only light can do that. Hate cannot drive out hate; only love can do that.",
      "author": "Martin Luther King Jr.",
      "source": "Strength to Love",
      "sourceUrl": "https://en.wikiquote.org/wiki/Martin_Luther_King,_Jr.",
      "categories": ["healing", "hope"],
      "approved": true,
      "active": true
    },
    {
      "id": "franklin-energy",
      "quote": "Energy and persistence conquer all things.",
      "author": "Benjamin Franklin",
      "source": "Poor Richard's Almanack",
      "sourceUrl": "https://en.wikiquote.org/wiki/Benjamin_Franklin",
      "categories": ["perseverance", "encouragement"],
      "approved": true,
      "active": true
    },
    {
      "id": "epictetus-events",
      "quote": "It is not what happens to you, but how you react to it that matters.",
      "author": "Epictetus",
      "source": "Enchiridion",
      "sourceUrl": "https://en.wikiquote.org/wiki/Epictetus",
      "categories": ["wisdom", "courage"],
      "approved": true,
      "active": true
    }
  ]
}
